# version: CHB v1 (standalone) | generated: 2026-06-17 | seed: 42 | input: datasets & cell-types used by node_channel_handling_expression; counts live from objects, provenance from DATA_SOURCES.md
dataset,object_file,accession,tissue_stage,chemistry,platform_used,donors,citation,n_cells_object,n_cells_used
Lim/Protze (fetal SAN),lim2024_fetal_san_qc.h5ad,GEO GSE279630 / GSM8577299,"human fetal sinoatrial node, GW19",10x snRNA-seq,10x snRNA (single-nucleus),single fetal donor,"Lim, … Protze; GSE279630 (fetal SAN, CD34-marker study)",9272,2954
Lim/Protze (fetal AVN),lim2024_fetal_avn_qc.h5ad,GEO GSE297072 / GSM8983395 (dissected fetal-tissue sample only; NOT the hPSC-derived samples),human fetal atrioventricular node,10x snRNA-seq,10x snRNA (single-nucleus),single fetal donor,"Lohbihler, Lim, … Protze; GSE297072 (same group as SAN; deposited 2025)",13407,6947
Kanemaru 2023 (adult conduction),kanemaru_conduction_qc.h5ad,"Heart Cell Atlas (heartcellatlas.org), conduction object",adult human SAN/AVN + working ventricle,object as a whole: 10x snRNA + Multiome-RNA + scRNA,"Multiome-RNA single nuclei ONLY: SAN_P/AVN_P pacemaker states are 100% Multiome (SAN/AVN regions sequenced only by Multiome); vCM RESTRICTED to Multiome AND to true ventricular regions (LV/RV/SP/AX), excluding AVN-dissected working CMs that are also labelled vCM",multiple adult donors (20-75 yr),Kanemaru et al. 2023 Nature,715108,67244
Sim 2021 (dev ladder),sim2021_qc.h5ad,GEO GSE156703,human heart fetal / child / adult CM (within-study dev axis),10x snRNA,"10x snRNA (single-nucleus); whole-CM, no nodal split",3 fetal + 3 child + 3 adult,Sim et al. 2021,52613,27483
