# version: CHB v1 (standalone) | generated: 2026-06-18 | seed: 42 | input: supplementary dataset provenance (one row per dataset); from config_chb_handling_panel.DATASET_PROVENANCE
dataset,object_or_dir,accession,tissue_stage,chemistry,platform_used,donors,citation
Lim/Protze (fetal SAN),lim2024_fetal_san_qc.h5ad,GEO GSE279630 / GSM8577299,"human fetal sinoatrial node, GW19",10x snRNA-seq,10x snRNA (single-nucleus),single fetal donor,"Lim, … Protze; GSE279630 (fetal SAN, CD34-marker study)"
Lim/Protze (fetal AVN),lim2024_fetal_avn_qc.h5ad,GEO GSE297072 / GSM8983395 (dissected fetal-tissue sample only; NOT the hPSC-derived samples),human fetal atrioventricular node,10x snRNA-seq,10x snRNA (single-nucleus),single fetal donor,"Lohbihler, Lim, … Protze; GSE297072 (same group as SAN; deposited 2025)"
Kanemaru 2023 (adult conduction),kanemaru_conduction_qc.h5ad,"Heart Cell Atlas (heartcellatlas.org), conduction object",adult human SAN/AVN + working ventricle,object as a whole: 10x snRNA + Multiome-RNA + scRNA,"Multiome-RNA single nuclei ONLY: SAN_P/AVN_P pacemaker states are 100% Multiome (SAN/AVN regions sequenced only by Multiome); vCM RESTRICTED to Multiome AND to true ventricular regions (LV/RV/SP/AX), excluding AVN-dissected working CMs that are also labelled vCM",multiple adult donors (20-75 yr),Kanemaru et al. 2023 Nature
Sim 2021 (dev ladder),sim2021_qc.h5ad,GEO GSE156703,human heart fetal / child / adult CM (within-study dev axis),10x snRNA,"10x snRNA (single-nucleus); whole-CM, no nodal split",3 fetal + 3 child + 3 adult,Sim et al. 2021
Cui 2019 (fetal STRT),cui2019_gse106118,GEO GSE106118,"human fetal heart CM, gestational wk 5-25",STRT / non-10x (Smart-seq-family),STRT (non-droplet),multiple fetal samples,Cui et al. 2019
Wang 2020 (adult STRT),wang2020_gse109816,GEO GSE109816,human adult heart CM (LA + LV),STRT / non-10x (Smart-seq-family),STRT (non-droplet),multiple adult samples,Wang et al. 2020
Lázár 2025 (HDCA first-trimester),lazar2025,Mendeley Data 10.17632/fhtb99mdzd.1 (open processed); raw under EGA EGAS50000001029,"human developing heart, first trimester (pcw 5.5-14)",10x snRNA,10x snRNA (single-nucleus); whole-heart atlas,13 first-trimester donors / 21 samples,Lázár et al. 2025 (HDCA)
